,Unnamed: 0,News,Label
1404,1254,The unexpected and ingenious strategy of Obama's second term,TRUE
1306,1156,EgyptAir crash: official dismisses claim that remains suggest blast,TRUE
541,391,"Sanders, Trump easily win West Virginia primary; Trump picks up Nebraska too",TRUE
525,375,Miracles Man: Metaxas Vs. Closed Minds And A Closed Universe,TRUE
705,555,Rigged Election: Hillary & Trump Caught Partying with Kissinger at Jesuit Gala,FALSE
1248,1098,Donald Trump threatens to jail Hillary Clinton in second presidential debate,TRUE
390,240,Israel stole classified US information and used it to help congressional Republicans,TRUE
1037,887,Shallow 5.4 magnitude earthquake rattles central Italy; shakes buildings in Rome,FALSE
328,178,BUSTED: Clinton Foundation Directly Tied To Plot To Steal Election,FALSE
238,88,Where Does Bernie Sanders Go From Here?,TRUE
107,107,The (federal) debt is growing by more than $4 billion a day.,TRUE
619,469,Obama says world should address grievances that terrorists exploit,TRUE
1398,1248,Justice Department Launches Civil Rights Probe Of Baltimore Police,TRUE
93,93,Says a poll found him the only Republican candidate who could beat Barack Obama in Texas -- and by eight points.,TRUE
1219,1069,BREAKING: THE REAL REASON HILLARY CLINTON WONT BE CHARGED BY THE FBI,FALSE
703,553,"City, County Leaders Ask Court To Lift Injunction On Obama Immigration Programs",TRUE
1103,953,OFF TOPIC: Unlike Muslimshorses actually do have a sense of humor,FALSE
1271,1121,Reince Priebus is in over his head,TRUE
843,693,FACEBOOK Nazi Thought Police editors threaten to quit if Mark Zuckerberg doesnt ban Donald Trump for hate speech,FALSE
986,836,CETA: Canada Has Challenged The EUs Chemical Regulations 21 Times,FALSE
985,835,Is it possible to fix the polarization of American politics?,TRUE
286,136,Re: 10 Things That Every American Should Know About Donald Trumps Plan To Save The U.S. Economy,FALSE
979,829,"Donald Trump, president of the Confederacy: The Southern strategy created the GOP civil war",TRUE
269,119,Obama's terror strategy is failing: US must heed lessons of 9/11,TRUE
1470,1320,Why Koch and Republican donor network wont back Trump (+video),TRUE
641,491,"Ryan so far proves he can 'make the sausage,' but he'll likely be serving a much different House party in 2016",TRUE
542,392,"Clinton, Sanders to Face Off in 1st Democrat Debate",TRUE
1326,1176,California slashes water use for upstate farmers,TRUE
1391,1241,Former Apprentice contestant accuses Trump of groping her during job meeting,TRUE
1118,968,Why Bernie Sanders's campaign makes me worry about how hell manage the White House,TRUE
907,757,"People Power! Natives declare treaty rights, police admit defeat - cite lack of 'manpower' to remove DAPL protesters",FALSE
929,779,Contaminated Food from China Now Entering the U.S. Under the 'Organic' Label,FALSE
448,298,"Re: WikiLeaks: Neera Tanden has ANOTHER ringing endorsement for Hillary! (No, not really)",FALSE
1020,870,"In Baltimore's call for federal police probe, a new search for answers (+video)",TRUE
1226,1076,"Lesson learned? Goldman Sachs says not to expect ""Brexit-type surprise"" on Nov. 8",FALSE
1358,1208,| Man whose son was killed by illegal immigrant files two suits against feds,FALSE
1427,1277,The Last Confirmation Bias Test of This Election,FALSE
706,556,Democrats Clinton and Sanders pounce on Flint water crisis  and each other,TRUE
1064,914,The President Of The United States of America: Donald J. Trump,FALSE
459,309,BREAKING: Man Brags on Facebook of Voting 3 Times Then Reveals How He Did It,FALSE
1255,1105,Marcus Mumford after Bundy verdict.,FALSE
1003,853,President Obamas Interview With Samantha Bee Will Have You Rolling On The Floor Laughing (VIDEO),FALSE
123,123,"Gov. Rick Scott cut the cost of prepaid college tuition by nearly $20,000.",TRUE
92,92,The insurance commissioner cant do squat about health care.,TRUE
800,650,Hillary Clinton's Postapocalyptic Hellscape Plan??,FALSE
981,831,Kerry orders State Department review of records retention amid Clinton email controversy,TRUE
381,231,"Scott Walker, Rick Perry show limits of super PACs",TRUE
517,367,"Drudge, Koch, Soros, Bezos: These 4 non-politicians will determine the next president",TRUE
786,636,Guardian Front Page: A 16-Year-Old Migrant Cries,FALSE
656,506,Democratic debate: Fact-checking the candidates,TRUE
219,69,Handicapping the Hispanic vote for 2016 GOPers,TRUE
1009,859,Pentagon: No Plan So Far For US Troops to Enter Mosul,FALSE
716,566,October 28: Daily Contrarian Reads,FALSE
718,568,The Sad Truth About Melania Trumps Plagiarism Snafu,TRUE
997,847,Swing-state stunner: Trump has edge in key states,TRUE
1334,1184,Tribute to the Last Honorable US Senator: The Story of Paul Wellstones Suspected Assassination,FALSE
844,694,Rivals Slam Trump over Violent Rallies: 'He Incites Violence',TRUE
20,20,Women and men both are making less when you adjust for inflation than when John Kitzhaber was first elected governor.,FALSE
567,417,Just Another Day In the Life of the Clinton Crime Family,FALSE
849,699,What A Hillary Presidency Would Bring,FALSE
14,14,Most of the (Affordable Care Act) has already in some sense been waived or otherwise suspended.,FALSE
803,653,Raise the wage: Paul Krugman shatters the myth that we cant afford to boost workers pay,TRUE
362,212,Justice Clarence Thomas Describes Washington DC As Broken,FALSE
967,817,WELCOME TO PARIS where tour buses have to navigate around all the new Muslim tent cities filling the streets,FALSE
187,37,Ex-Assistant FBI Director: Clintons Are a Crime Family,FALSE
795,645,What I Learned From Speaking to an R.N.C. Attendee From Every State,TRUE
1275,1125,Identity of ISIS terrorist known as 'Jihadi John' reportedly revealed,TRUE
1354,1204,BOMBSHELL: Hillary Clintons Leaked Audio Proves She Rigs Elections,FALSE
1071,921,Two Points About the Hillary Clinton Email Fiasco,FALSE
143,143,President Obama took more money from Wall Street in the 2008 campaign than anybody ever had.,TRUE
560,410,"America Might Not Deserve Trump, But Dems and Hillary Deserved To Lose",FALSE
796,646,Zakharova: Kiev's talk of an armed OSCE mission is disinformation,FALSE
469,319,Jeb Bush loses TV ad edge to Marco Rubio,TRUE
949,799,Trump slams GOP nominating process as top aide accuses Cruz of 'gestapo tactics' to win delegates,TRUE
306,156,How Clinton plans to stop Sanders' momentum,TRUE
493,343,The Hulk Actor Mark Ruffalo Has Joined Standing Rock to Protest DAPL,FALSE
568,418,Muslims regularly use Inshallah (God Willing in Arabic) and nobody calls it Christophobic hate speechso why is Deus Vult (God Willing in Latin) graffiti being called Islamophobic Crusader hate speech?,FALSE
1321,1171,Twenty Years of a Dictatorial Democracy     : Information,FALSE
1031,881,"In a revealing interview, Trump predicts a massive recession but intends to eliminate the national debt in 8 years",TRUE
589,439,War on Drugs Heading in Wrong Direction?,FALSE
1119,969,What DNC Donors REALLY think of African Americans,FALSE
1135,985,"Politico Tries to Destroy Trump, But It Backfires IMMEDIATELY",FALSE
400,250,"Donald Trump said university was all about education. Actually, its goal was: Sell, sell, sell!",TRUE
686,536,Clinton Enjoys Post-DNC Bounce - But Will it Last?,TRUE
467,317,The Rise of Mandatory Vaccinations Means the End of Medical Freedom,FALSE
846,696,"Jeb Bush in 2016: The good, the bad and the ugly",TRUE
1462,1312,British PM Refuses To Withdraw Support For Saudi Arabia,FALSE
380,230,Laura Bush hints she'd rather see Hillary as president,TRUE
1465,1315,"Obama, Erdogan Discuss Need for Close Cooperation to Counter Daesh",FALSE
1132,982,"US sailors freed by Iranians. No US apology issued, says Joe Biden",TRUE
534,384,Physicists Say Consciousness Should Be Considered A State of Matter: The Non Physical Is Real,FALSE
203,53,New Comment Features have been Added,FALSE
1133,983,Could This Be the Real 'Super Tuesday'? A Look at What's at Stake,TRUE
182,32,"Brexit Encourages UK to Trade With Non-EU States, Including Russia",FALSE
934,784,Inside Jeb's 'shock and awe' launch,TRUE
877,727,Farming Invented Many Times by Many Different Farmers Over A Vast Landscape. @CarlZimmer. @NYTimes. - Russia News Now,FALSE
587,437,"Experts Recommend Breaking Down Crushing Defeats Into Smaller, More Manageable Failures - The Onion - America's Finest News Source",FALSE
1475,1325,"This Will END Hillarys Campaign, HILLARY CLINTON IS GOING DOWN",FALSE
1434,1284,BREAKING: Trump Rushed Off Stage After Alleged Gunman Found in Rally Audience,FALSE
957,807,Donald Trump's Clintonesque foreign policy,TRUE
1212,1062,Fashwave Friday: Endgame,FALSE
293,143,Trumped!,FALSE
1243,1093,PATRIOT Act At 15: Do You Feel Safer?,FALSE
90,90,"Phoenix, Arizona, is the No. 2 kidnapping capital of the world.",FALSE
162,12,"Strong Solar Storm, Tech Risks Today | S0 News Oct.26.2016 [VIDEO]",FALSE
851,701,This is What Will Happen to Mosul After ISIS is Evicted,FALSE
1273,1123,Excruciating choice for GOP leaders: Take a risk on Trump?,TRUE
440,290,People excited about Christmas adverts told about rest of human culture,FALSE
278,128,Monsieur Malbrough est Mort | New Eastern Outlook,FALSE
406,256,"'You've been fleeced': Congress grills Kerry, Obama officials on Iran nuke deal",TRUE
1308,1158,Powerful Photo Series Challenges Societys Perception Of The Obese,FALSE
343,193,Who had to go :-),FALSE
1058,908,"Christie Hides $800,000 in Travel Bills",TRUE
470,320,"Russia, India Discuss FGFA Advanced Fighter, Su-30MKI Upgrade",FALSE
295,145,Saturns Baffling Hexagon  The Raging Storm Four Times the Size of Earth has Changed Its Colors,FALSE
1163,1013,Reasons to Risk Nuclear Annihilation,FALSE
254,104,Where is Gary Johnson?,TRUE
768,618,FBI reopens Clinton investigation as new emails found  Comey,FALSE
1134,984,"Thanks to Obama, the terrorist cancer is growing",FALSE
523,373,If Hillary Clinton Is Charged With Obstruction Of Justice She Could Go To Prison For 20 Years,FALSE
5,5,The Chicago Bears have had more starting quarterbacks in the last 10 years than the total number of tenured (UW) faculty fired during the last two decades.,TRUE
1268,1118,Alabama Sen. Sessions Backs Trumps Immigration Platform,TRUE
466,316,John Oliver: Americas Increasingly Segregated Schools Are Very Rarely Equal in Any Way (Video),FALSE
88,88,"Sen. McCain's tax plan provides ""virtually nothing to the middle class.""",FALSE
671,521,BrotherJohnF Silver Update: Fake Election,FALSE
1168,1018,"We won, you lost, get over it Brexiters told outside High Court",FALSE
659,509,"Hillary isn't winning over many pundits, even on the left",TRUE
903,753,Comment on This is My Second One  Virginia Cop Caught Bragging About Killing Two Unarmed People by Jamieson,FALSE
382,232,If Catcalls Were Politically Correct,FALSE
1457,1307,New Study Shows Riots Make America Conservative,TRUE
6,6,Jim Dunnam has not lived in the district he represents for years now.,FALSE
906,756,CLINTON EMAIL INVESTIGATION HAS SHIFTED THE POLLS SIGNIFICANTLY IN TRUMPS FAVOR,FALSE
1010,860,Russian pianist Denis Matsuev terrorized in US for supporting Putin,FALSE
106,106,"Since Gina Raimondo took office, investment fees on the states pension portfolio have gone up from about $12 million annually to about $50 million.",TRUE
637,487,The World Is About To Witness A Breathtaking Once In A Century Event,FALSE
126,126,You had more women getting computer sciences degrees in the 80s by a factor of 2-plus than you do now.,TRUE
759,609,Anti-Trump delegates now responsible for nominating him,TRUE
96,96,Did you know US population growth is at its lowest since the Great Depression?,TRUE
205,55,Ying and Yang (the Gold and Silver Set-Up),FALSE
897,747,JASON CHAFFETZ EXPOSED HILLARY CLINTONS PLAN TO BRIBE FBI AGENTS TO LET HER GO,FALSE
1215,1065,Chris Christie Bolsters Political Team as Allies Launch Super PAC,TRUE
879,729,Why Comey Reopened the Hillary Investigation,FALSE
210,60,Biden makes another surprise political stop,TRUE
690,540,Genetically Modified Crops in U.S. Fail to Deliver Expected Yields,FALSE
749,599,The media unload on Donald Trump,TRUE
1294,1144,War is eminent,FALSE
1035,885,Obama: Gov. Scott Walker needs to bone up on foreign policy,TRUE
120,120,"After Britains vote to leave the European Union, within 24 hours, Americans lost $100 billion from our 401(k)s.",TRUE
527,377,Collective Consciousness  The Individual is Gone,FALSE
1448,1298,Hotel CEO Caught Celebrating Using Government to Make Airbnb Illegal So They Can Price Gouge,FALSE
1196,1046,GOP Candidates Say Paris Attacks Highlight U.S. Leadership Failure,TRUE
896,746,CNBC Just Confirmed Comey Is Abusing His Power To Help Trump,FALSE
1455,1305,Will Latino loathing of Trump drive a voter movement to swing the election?,TRUE
640,490,CAN'T TRUST OBAMA! Look At Sick Thing He Just Did To STAB Trump In The Back... * LIBERTY WRITERS NEWS,FALSE
572,422,"2 deaths possibly linked to 'superbug' at UCLA hospital after 7 infected, 179 exposed",TRUE
607,457,Carrot Top To Give Nobel Awards At Drive Thru Window,FALSE
348,198,Can Sanders rally supporters around Clinton after DNC email leak?,TRUE
129,129,About 3 percent of murders and crimes are committed with guns from people who actually (legally) purchase those guns.,TRUE
609,459,Gauis Publius: TPP Has Picked Up a Powerful Enemy  Black Lives Matter,FALSE
552,402,'Blue and Brave': Illinois town rallies around police as search for officer's killer goes on,TRUE
520,370,Comment on Police Officers Wife Caught Faking a Robbery In a Scheme To Frame Black Lives Matter by The Cat's Vagina (Nasty Woman),FALSE
994,844,Netanyahu's Iran Speech: Why it's important for Congress to at least listen to Israel's leader,TRUE
1156,1006,Cuba has a possible lung cancer vaccine that America can now test,TRUE
562,412,State Department admits to deliberately cutting briefing footage on Iran deal,TRUE
553,403,Senate Advances Bill To Approve Keystone Pipeline Despite Obama's Veto Threat,TRUE
602,452,'America is already strong': Obama continues Democrats' optimism,TRUE
1240,1090,"If Donald Trump Wins The Election, It Will Be The Biggest Miracle In US Political History",FALSE
728,578,UFO Investigator - MAX SPIERS - Found Dead After Vomiting Black Liquid.,FALSE
267,117,"Geo-Engineering Unlikely to Work, Conservation Group Says",FALSE
816,666,Kevin McCarthy announces he's a candidate for House speaker (+video),TRUE
324,174,Should Christians Celebrate Halloween?,FALSE
1383,1233,Can Sanders' millennials switch to Clinton?,TRUE
52,52,Says Terry McAuliffe is the person who invented the scheme to rent out the Lincoln Bedroom.,FALSE
1289,1139,German Defense Minister warns Donald Trump to stay away from Russia and commit full to NATO,FALSE
530,380,The Clock Is Ticking And Republicans Still Have No Serious Obamacare Alternative,TRUE
880,730,Hillary: Leaked Audio of Her Discussing Rigging an Election in Palestine,FALSE
372,222,A Case Study On Why The Obamacare Lawsuit Is Based On Mythical History,TRUE
385,235,"Clinton has delegates to win Dem nomination, AP reports; Sanders questions tally",TRUE
1352,1202,Bill Clintons Lover: He Called Ruthless Hillary The Warden,FALSE
113,113,Says Obama promised unemployment would never go above 8 percent.,FALSE
1143,993,Canada Just Threw A Grenade Into Elizabeth Warren's Trade Fight With Obama,TRUE
1424,1274,Must Watch: When People Laughed At Donald Trump And Anyone Who Said He Would Win,FALSE
715,565,Kasich bows out. Did he do 'the right thing?',TRUE
412,262,The Impossible Is Happening: Cubs Win World Series and Yes Hillary Clinton is Now Likely to be Indicted,FALSE
420,270,"Yes, Ted Cruz could win",TRUE
878,728,Netanyahu warns Iran deal could 'threaten the survival' of Israel,TRUE
492,342,Russia successfully tests its first-ever hypersonic weapon,FALSE
830,680,Understanding Propaganda - The Art Of Distraction And Disinformation,FALSE
687,537,Alabama Prison Officials Retaliate Against Prison Strike Leader By Cutting Water To Cell,FALSE
11,11,"Since 2000, nearly 12 million Americans have slipped out of the middle class and into poverty.",TRUE
1131,981,A brutal spoof advert for the new Macbook that highlights everything it doesnt have,FALSE
403,253,"The role of the US and Nato in EU relations with China, by Manlio Dinucci",FALSE
838,688,Source: Baltimore mayor ordered police to stand down,TRUE
956,806,"With Another Deadline Looming, Whispers Of Iran Nuclear Deal Emerge",TRUE
510,360,David Duke wins Louisiana Senate Debate in Landslide despite BLM Riots,FALSE
371,221,'Spinning up as we speak': Email shows Pentagon was ready to roll as Benghazi attack occurred,TRUE
872,722,Now We Can Finally Get to Work,FALSE
1460,1310,"Anti-terrorism crackdowns may have spurred attackers, Belgian prosecutor says",TRUE
870,720,Debating the Future of American Power Abroad,TRUE
1429,1279,Unprecedented letter from Chair of Joint Chiefs suggests U.S. military does not want a President Hillary,FALSE
1338,1188,French Political Leader: France is about to Enter a Holy War with Islam  Embrace Christianity Never Accept the Religion of Satan,FALSE
21,21,The United States has the highest corporate tax rate in the free world.,TRUE
449,299,Reality Check: First Clinton v Trump presidential debate,TRUE
1314,1164,"On climate change, ideological and partisan polarization hardens",TRUE
942,792,"In Jamaica, Obama indicates that he will remove Cuba from terrorism list",TRUE
890,740,The Militarized Police at Standing Rock is Working for This Man,FALSE
1004,854,The End of the Road for John Kasich,TRUE
783,633,U.S. Congressional Delegation travels to Cuba this weekend,TRUE
613,463,Going Back to the Future in 2016?,TRUE
179,29,"Syrian War Report  November 1, 2016: Syrian Military Deploys Advanced T-90 Battle Tanks to Aleppo",FALSE
215,65,Loretta Lynch becomes first African-American woman AG.,TRUE
1342,1192,John Roberts helps overthrow the Constitution,TRUE
1331,1181,Press release on Foreign Minister Sergey Lavrovs meeting with Namibian Deputy Prime Minister and Minister of International Relations and Cooperation Netumbo Nandi-Ndaitwah - Russia News Now,FALSE
1177,1027,U.S. LAWMAKERS RAISE PRIVACY CONCERNS OVER NEW HACKING RULES,FALSE
200,50,Anti-Muhammad cartoon contest: Free speech or deliberately provocative? (+video),TRUE
338,188,Someone Isn't Telling The Truth About Freddie Gray's Death,TRUE
1093,943,HIV Cure Almost Complete after Scientists Remove Viruss DNA from Living Tissue,FALSE
450,300,Doomsday Election,FALSE
1202,1052,The problem with Cruz and Kasich aligning to stop Donald Trump,TRUE
290,140,Justice Department Staffers Monitor Polls on Election Day,TRUE
31,31,"If you look at states that are right to work, they constantly do not have budget deficits and they have very good business climates.",FALSE
808,658,"Budgeting the Good War, for 75 Years",FALSE
378,228,Donald Trump's GOP civil war,TRUE
196,46,Senate race rankings: Dems attack as GOP lays swing-state groundwork,TRUE
1161,1011,Our Debt to Paula Jones,FALSE
1076,926,Why the Iraq offensive will fail,TRUE
620,470,7 Ways To Prepare For An Economic Crisis,FALSE
895,745,Western QLD Drovers Show Solidarity With C.U.B Workers By Only Drinking Sauv Blanc  The Betoota Advocate,FALSE
1327,1177,Re: French Political Leader: France is about to Enter a Holy War with Islam  Embrace Christianity Never Accept the Religion of Satan,FALSE
43,43,Says Ohio budget item later signed into law by Gov. John Kasich requires women seeking an abortion to undergo a mandatory vaginal probe.,FALSE
463,313,Nurse Chris Christie Quarantined For Ebola Goes After Governor On Vaccines,TRUE
35,35,We have a federal government that thinks they have the authority to regulate our toilet seats.,TRUE
109,109,"Of our 98,000 teachers who are K-12, over 53,000 of those teachers today are over 50 years old.",FALSE
443,293,Pope Francis implores Congress to accept immigrants as their own,TRUE
1251,1101,Tics and tricks: Here's what Trump and Clinton's body language reveals,TRUE
1110,960,Jeb's invisible man strategy,TRUE
233,83,John Kerry: ISIS responsible for genocide,TRUE
696,546,Hillary Clinton BETRAYED by Her Own Family: Were Voting for Trump!,FALSE
428,278,"In France, a growing debate over why some speech is protected and some isnt",TRUE
915,765,What Walker's Departure Means for GOP Field,TRUE
742,592,Why Director Comey jumped at the chance to reopen Hillary investigation,FALSE
904,754,"Hillary Clinton Promises Steady Leadership, More Jobs in Historic Speech",TRUE
1365,1215,"Space Wars Likely In The Future As US, Russia Develop Satellite Weapons",FALSE
68,68,U.S. Rep. Phil Gingrey gave the government the power to electronically spy on Americans without a warrant.,FALSE
976,826,The NRA Just Admitted It Was Always Lying About Obama Confiscating Guns,FALSE
730,580,Clinton Campaign STUNNED As FBI Reportedly Reopens Probe Into Hillary Clinton Emails,FALSE
503,353,Comment on U.S. war with Iran has already begun by      /    1390 - ,FALSE
53,53,"We created 800,000 new jobs, we cut the unemployment rate almost in half and today New York State has more private sector jobs than it has ever had in its history",TRUE
813,663,Both Clinton and Trump would bring a war-time posture to the White House,TRUE
909,759,How hackers eroded Americans' trust in democratic process,TRUE
1187,1037,Stossel: Why Marco Rubio and Hillary Clinton are 2016's likely nominees,TRUE
284,134,"REPORT: Megyn Trashes Trump, Newt Then Murdoch Announces Replacements Are Available",FALSE
627,477,Unprecedented Surge In Election Fraud Incidents From Around The Country,FALSE
578,428,Your Facebook Page Could Land You In a FEMA Camp,FALSE
139,139,Newt Gingrichs immigration plan offers a new doorway to amnesty.,TRUE
522,372,Supreme Court Decides to Weigh in On Transgender Rights,FALSE
38,38,"In the case of a catastrophic event, the Atlanta-area offices of the Centers for Disease Control and Prevention will self-destruct.",FALSE
1025,875,CNN Calls Sheriff Clarke A Terrorist After Trump Considers Giving Him An Incredible New Job | EndingFed News Network,FALSE
1371,1221,The US Elections Do Matter But Not Necessary To Follow Them  Sheikh Imran Hosein,FALSE
464,314,Can Paul Ryan and Donald Trump coexist within the Republican Party?,TRUE
310,160,Christianity under attack: US must do more to promote religious freedom,TRUE
540,390,"Iranians Spend $2.1b on Beauty Products Annually, 3 Times more than Their European Counterparts",FALSE
1397,1247,"If Clinton Campaign Believes WikiLeaks Emails Are Forged, Why Dont They Prove It!?",FALSE
856,706,(((Smithsonian))) Refuses to Include Judge in Black Museum Because He has Normal People Opinions,FALSE
1388,1238,ISIS: Mortal Threat Or Paper Tiger?,FALSE
505,355,"GOP braces for Trump loss, roiled by refusal to accept election results",TRUE
59,59,"In 2008, only 54 percent of Latinos in Texas were registered to vote and only 35 percent actually turned out.",TRUE
314,164,Are Tensions With Russia Even Real?,FALSE
455,305,McCarthy drops out of speaker race as House asks: Who wants this job? (+video),TRUE
710,560,"Trump Vows To ""Renovate"" the Bill of Rights",FALSE
648,498,"Architect Of Paris Attacks Was Killed In Raid, French Authorities Say",TRUE
1322,1172,"Decorated Hero Cop Caught Using His Authority to Steal $170,000 in State Fees",FALSE
1250,1100,Has science gone too far?,FALSE
601,451,"Blame government, not markets for monopoly",FALSE
74,74,The cost of health care is now the single-biggest factor driving down the federal budget deficit.,TRUE
1440,1290,Economic Nationalism: Alternative To Globalism,FALSE
