,Unnamed: 0,News,Label
451,301,John Kasichs Advice for Women to Prevent Sexual Assault: Avoid Parties Where Theres a Lot of Alcohol,TRUE
826,676,18 State Swat Team Drill In Prep for Backlash Against a Stolen Election,FALSE
629,479,A report said Trump's donations to vets might be shady. His response was predictable.,TRUE
1237,1087,"32,000 emails recovered in IRS targeting probe amid allegations agency chief may have lied",TRUE
1445,1295,Lawmakers Who Have Forgotten Iraq Insist They're Right About Iran,TRUE
1313,1163,"Cruz eyes insurance via Obamacare, a law he vows to scrap (+video)",TRUE
1382,1232,John Olivers Smear Tactics Exposed As Establishment Propaganda,FALSE
436,286,"Trumka: Disappointment with Obama, a warning for Hillary",TRUE
151,1,Watch The Exact Moment Paul Ryan Committed Political Suicide At A Trump Rally (VIDEO),FALSE
1088,938,Donald Trumps campaign of terror: How a billionaire channeled his authoritarian rage  and soared to the top of the polls,TRUE
1150,1000,His campaigns statement that Trump accepts the truth of Obamas birthplace is filled with falsehoods,TRUE
524,374,"'Top secret' emails on Clinton server discussed drone program, may reference classified info",TRUE
516,366,THE VISION THING 16    : Information,FALSE
1151,1001,"White House, Dems seek to water down Iran bill",TRUE
188,38,Hillary Wants Aggressively Interventionist Foreign Policy,FALSE
919,769,Trumps Star Vandalized On Hollywood Walk Of Fame - The Onion - America's Finest News Source,FALSE
725,575,"CLINTON, INC: WATCH HOWS IT PAINS MSM TO REPORT CLINTON CORRUPTION",FALSE
1231,1081,"Trump claims GOP nomination, tells struggling Americans 'I am your voice'",TRUE
373,223,Trump Proudly Declares: Most Of The People Ive Insulted Deserved It,FALSE
474,324,"Poll: Hillary Clinton, Bernie Sanders both top Trump",TRUE
232,82,Celebrity Deathmatch: Darkmoon Sages Make Their Final Predictions on US Election,FALSE
1337,1187,Comment on 10 Strange Facts About Our Presidents by tania de saram,FALSE
606,456,"For First Time, Trump Shrinks In Spotlight; Fiorina Steals Show",TRUE
1420,1270,NSA program reportedly helped US gather evidence against North Korea in Sony hack,TRUE
54,54,"We have towns in West Texas that are out of water, that are having to truck in water.",FALSE
1390,1240,"In rare foreign trip, Assad flies to Moscow to meet with Putin",TRUE
504,354,Its not the locker-room talk. Its the lock her up talk.,TRUE
1270,1120,How the Oligarchy Has Prepared the Groundwork for Stealing the Election,FALSE
58,58,Sen. Obama's campaign announced that he's choosing his cabinet.,FALSE
1139,989,Republicans in Congress are ready for Hillary as they prepare for new probes into Clinton Foundation,FALSE
563,413,"U.S. Economy Added 271,000 Jobs In October, Beating Expectations",TRUE
1021,871,Freedom Rider: Organizing in the Age of Hillary,FALSE
64,64,"Under Mayor Cicilline, [Providence] was a sanctuary city.",FALSE
1328,1178,Bernie Sanders is unleashing a plan to make prescription drugs cheaper,TRUE
1298,1148,What do Americans really think about abortion? The answer may surprise you.,TRUE
781,631,"A ""Gesture of Thanks"": Turkey arrests terrorists for extradition to Russia",FALSE
574,424,GOP Senator Silences the Entire Room With Remark About War Hero Opponent's Heritage at Debate,FALSE
1258,1108,Republicans are crossing a dangerous new line: sabotaging US foreign policy,TRUE
1030,880,FBI Investigating New Clinton Emails - The Onion - America's Finest News Source,FALSE
171,21,Episode #160  SUNDAY WIRE: Hail to the Deplorables with special guest Randy J,FALSE
758,608,Meet The Man Who Started The Illuminati,FALSE
116,116,"In a majority of states, you can now marry freely, but can still be fired for who you love.",TRUE
374,224,Dems sue GOP over Trump's 'rigged' complaints,FALSE
782,632,President Obama really really really really hates Maureen Dowd,TRUE
1032,882,Euro-Russian Mars Lander May Have Exploded Due to Software Glitch,FALSE
1228,1078,"Obama Spends Earth Day In The Everglades, Taunting Republicans On Climate Change",TRUE
1097,947,Brian Williams Under Fire Over His Shifting Story Of Iraq Helicopter Attack,TRUE
1176,1026,SWEDISH OUTRAGE as Muslim colonizers get preference for housing while native Swedes are out in the cold,FALSE
931,781,Donald Trump: The next President of the United States of America,FALSE
814,664,"The GOP debate fear cauldron: According to the Republican candidates, youre going to die",TRUE
313,163,"Buffett: If I Ran Fed, I Would Not Raise Rates Significantly",TRUE
13,13,The economy bled $24 billion due to the government shutdown.,TRUE
1418,1268,"Like Warsaw ghetto: Attendees attacked, surrounded at Israeli speaker event at London university",FALSE
1041,891,The GOPs nuclear option for Donald Trump: Why the only way to beat him is so scary,TRUE
281,131,McCain: Trump doesn't understand Syria,TRUE
834,684,A Tea Party Congressman Just Called For Armed Uprising If Trump Loses,FALSE
973,823,NATO Buildup in Eastern Europe: Weve Only Seen the Tip of the Iceberg,FALSE
133,133,"We are already almost halfway to our 2010 goal of creating 700,000 new jobs in seven years.",FALSE
1347,1197,Experts Speechless! Countless People Miraculously Relieved of Serious Illness & Diseases-Must See!,FALSE
1179,1029,U.S. Currency Hidden Images,FALSE
17,17,"U.S. Rep. Ron Kind, D-Wis., and his fellow Democrats went on a spending spree and now their credit card is maxed out",FALSE
339,189,Prison employee pleaded not guilty to aiding escape of two murderers,TRUE
1279,1129,"After tragic shooting, Charleston church reopens with prayer, songs and tears",TRUE
1374,1224,Donald Trump Begs Hillary Clinton Early Voters to Change Their Votes,FALSE
1241,1091,"Comment on Creating a National Security State Democracy, Or How the American Political System Changed and No One Noticed by James Miller",FALSE
680,530,Jeb Bush fights lonely battle defending Common Core,TRUE
282,132,Trump manager says 'undercover voters' will deliver win in US election,TRUE
1249,1099,Cars That Broke Bad,FALSE
1188,1038,The Source of our Rage       :,FALSE
1059,909,Russia deploys missiles in Syria after Turkey shoots down bomber,TRUE
1316,1166,Neither Bush nor Rubio is placing above 4th in Iowa or New Hampshire,TRUE
1116,966,"Police Family Fakes Robbery, Vandalizes Own Home to Blame it On Black Lives Matter",FALSE
395,245,"Clinton, Sanders accuse Trump of inciting violence",TRUE
1277,1127,Homicides Up 55 PercentChicago Stays Vibrant,FALSE
1344,1194,UNs Yemen Peace Plan Would Sideline Former President Hadi,FALSE
46,46,"Obamacare will provide insurance to all non-U.S. residents, even if they are here illegally.",FALSE
654,504,COMICAL: Larry the Cable Guy slams indefensible hypocrisy from Donna Brazile,FALSE
736,586,"Trump, Sanders trade blame over Chicago protests",TRUE
414,264,Anderson Cooper Absolutely OWNS Kellyanne Conway After FBI Clears HillaryAgain (VIDEO),FALSE
1039,889,What Trump and Clinton are looking for in a VP,TRUE
1364,1214,GOP insiders: It was a rough night for Ted Cruz,TRUE
145,145,"Hillary Clinton has taken over $800,000 from lobbyists.",TRUE
288,138,Look at the SHOCKING Number of Kids Born To Illegals in 2014,FALSE
618,468,Uncovered audio: Hillary was adamantly against illegal immigrants,TRUE
163,13,10 Ways America Is Preparing for World War 3,FALSE
1166,1016,BAHAHA! Wanna bet Hillary made THIS face when she found out about the FBI? [photo],FALSE
854,704,Delete Your Account  Episode 23: Dont Get Sick,FALSE
714,564,Hillarys Big Tent is Obamas Grand Bargain on Steroids,FALSE
580,430,"Exclusive: More than 100 lawsuits, disputes over taxes tied to Trump and his companies",TRUE
508,358,Pope Francis met Kim Davis: why it matters in fight over religious freedom (+video),TRUE
1401,1251,Laura Ingraham: The Trump betrayal by Republican elites won't soon be forgotten,TRUE
1333,1183,12 and 63-minute videos: Donald Trump connects to false flag targeting Muslims. Did you really think our masters offer anything other than false choice between Left and Right arms of a .01% US rogue state?,FALSE
430,280,Russia reacts to UN aid chief's Aleppo 'kill zone' remarks,FALSE
738,588,Gas prices could drop toward $1 a gallon,TRUE
1232,1082,Quit Smoking! Smoking Cigarettes Causes 150 Genetic Mutations and Cancer,FALSE
928,778,Kentucky governor: Electing Hillary Clinton may eventually lead to violence,TRUE
15,15,"In this last election in November, ... 63 percent of the American people chose not to vote, ... 80 percent of young people, (and) 75 percent of low-income workers chose not to vote.",TRUE
224,74,Jeb Bush Picks Up Endorsement From Lindsey Graham,TRUE
211,61,"Hillary Clinton's declining favorability numbers, in context",TRUE
1252,1102,Green Partys Margaret Flowers Challenges US Senate Debate in Maryland as Undemocratic,FALSE
577,427,Clinton media campaign follows BuzzFeed model,TRUE
41,41,Says Marco Rubio skipped 18 defense votes including one to arm the Kurds to fight ISIS.,TRUE
556,406,Young Turks Finds Out Why Trump Is About To Lose Utah For Republicans For First Time In Decades (VIDEO),FALSE
809,659,Will the anti-Clinton revolt among American elites gain momentum?,FALSE
485,335,Ernst to Trump: Stop with the name-calling,TRUE
695,545,"Trump, Clinton clash in dueling DC speeches",TRUE
434,284,A dream come true for Hillary Clinton: Wall Street Journal editorial board rips Ted Cruz,TRUE
921,771,Nearly All Wild Animals Face Mass Extinction By 2020,FALSE
95,95,Says David Jolly supports privatizing Social Security.,FALSE
299,149,Shutdown clash to return in force by December,TRUE
787,637,Restaurant Chain Tim Hortons Blocks Independent Journalists Website on WiFi,FALSE
191,41,Real Disclosure! Secret Alien Base Found In Moon's Tycho Crater,FALSE
623,473,Daesh abducts 1000s near Mosul to use them as human shields: UN,FALSE
1078,928,"650,000 Emails Found On Anthony Weiners Laptop; DOJ Blocked Foundation Probe",FALSE
1193,1043,Trump Supporters Booby Trap Polling Place And Spill Blood Of Election Volunteer (VIDEO) | Addicting Info | The Knowledge You Crave,FALSE
285,135,Suspect captured in ambush-style killings of two Iowa cops,FALSE
1297,1147,"Trump wont commit to accepting election results, at fiery final debate with Clinton",TRUE
543,393,#InNorthDakota ~~ PALESTINIANS STAND WITH THE SIOUX,FALSE
125,125,"As Florida's CFO, I shut down Krakow's scam and refunded more than $1.2 million to Josephine and other victims of this con man.",TRUE
25,25,I dont know who (Jonathan Gruber) is.,FALSE
1417,1267,'We the People' is at risk: Why America needs civics education,TRUE
1265,1115,"Clinton, Trump and Obama aren't telling American workers the truth. Here it is",TRUE
342,192,President Trump: A colossal failure for democracy and our terrifying new reality,TRUE
638,488,Forbidden History. Secret Egyptology Exposed!,FALSE
56,56,A federal system that verifies employees are authorized to work in the U.S. is inaccurate anywhere from 50 percent all the way up to in excess of 80 percent of the time.,TRUE
251,101,Accord reached after Sanders sues the DNC over suspended access to critical voter list,TRUE
70,70,"If you take the population growth here in Virginia, we are net zero on job creation since (Bob McDonnell) became governor.",TRUE
586,436,Will a No-Fly Zone Help the People of Aleppo?,FALSE
871,721,Sesame Seeds for Knee Osteoarthritis,FALSE
1083,933,The GOP's big-money plan to save the Senate,TRUE
594,444,The Middle East Crises Trump Inherits Could Still Suck Him in,FALSE
1282,1132,Juror in Oregon militia trial dismissed for bias: judge,FALSE
257,107,Kevin MacDonald celebrates Trumps Amazing Victory,FALSE
1339,1189,Matt Bevin is the next governor of Kentucky. He has President Obama to thank.,TRUE
569,419,"Hillary Clinton, FBI and the Real November Surprise     : Information",FALSE
1223,1073,Take The Money!!: Emails Show How Clinton Campaign Manages Lobbyist Donations,TRUE
159,9,Iran reportedly makes new push for uranium concessions in nuclear talks,TRUE
764,614,"Report from the Refugee Camp in Calais, France: the Jungle",FALSE
277,127,"Putin Congratulates Trump, Says Russia Is Ready To Restore Relations With The US",FALSE
1387,1237,"Scalia, Thomas & Alito have totally lost it: The complete and utter incoherence of the conservative Supreme Court justices",TRUE
204,54,World's newspapers react to 'Hebdo' attack,TRUE
806,656,Hillary Clinton should proactively set out ethics rules,TRUE
596,446,John Kirby and the US State Department Blatantly Support Terrorists - Henry Kamens,FALSE
10,10,"For the first time in history, the share of the national popular vote margin is smaller than the Latino vote margin.",TRUE
944,794,Trump controlled by Mossad,FALSE
635,485,You Can't Be Intersectional While at the Same Time Being Elitist and Exclusionary,FALSE
206,56,"Closed primaries, 'warped' democracy?",TRUE
272,122,We Were Long Overdue A Presidential Assassination Anyway,FALSE
708,558,"No, Sanders wouldn't be a better match for Trump",TRUE
732,582,Physicists just found more hints of an elusive particle thats its own antiparticle,FALSE
1062,912,"Comment on Entitled Customer Slams Restaurant On Yelp, What Happens Next Is Sheer Badassery by customize your own jerseys",FALSE
1098,948,Getting 10 Minutes of Sunlight Per Day Can Stop Depression,FALSE
321,171,Undercover Video Exposes Obamas Plan to Make American Gun Laws More Like Britain  TruthFeed,FALSE
320,170,Trump's New Ad Portraying 'Every Mother's Worst Nightmare' is Nothing Short of Chilling,FALSE
1406,1256,Biggest Election Fraud In History Discovered In The United States,FALSE
1254,1104,Donald Trump's Problems Are Much Deeper Than A Campaign Manager,TRUE
160,10,"With all three Clintons in Iowa, a glimpse at the fire that has eluded Hillary Clintons campaign",TRUE
1144,994,"New Company Aims To Explore Intersection Of Technology, Other Thing - The Onion - America's Finest News Source",FALSE
1229,1079,Donald Trump doesn't challenge anti-Muslim questioner,TRUE
149,149,"On the VA: Over 300,000 veterans have died waiting for care.",FALSE
719,569,Will the Comey bombshell really shake up the 2016 race?,TRUE
852,702,Mall of America to Close for First Time Ever on Thanksgiving,FALSE
303,153,Blizzard of charges and countercharges melts away as opinions of Trump and Clinton are frozen,TRUE
271,121,Selma 50 years on: John Lewis's recalls the march,TRUE
1351,1201,Re: DePaul: Unborn Lives Matter Posters Are Veiled Bigotry,FALSE
1127,977,"Illegal Thug Returns After Deported Twice, Gives Sick Gift To Girlfriend",FALSE
673,523,'The only other option': Bernie Sanders backers turn to Green party's Jill Stein,TRUE
393,243,"Chaos on House floor as Dems, Republicans clash over LGBT proposal",TRUE
916,766,Julian Assange Ends The Suspense: The Source Of Hacked Emails Is Not Russia,FALSE
866,716,"Trump doctors letter: He takes cholesterol drug, is overweight but is in excellent health",TRUE
1047,897,November Kale,FALSE
250,100,Newly Approved GM Potatoes Have Potential to Silence Human Genes,FALSE
1478,1328,Teacher sickout closes most Detroit schools Monday,TRUE
1262,1112,"U.S. strike believed to have killed Jihadi John, Islamic State executioner",TRUE
173,23,New Senate majority leaders main goal for GOP: Dont be scary,TRUE
670,520,Now waiting for the results | Opinion - Conservative,FALSE
341,191,Election Day: No Legal Pot In Ohio; Democrats Lose In The South,TRUE
658,508,Carson takes lead from Trump in new national poll,TRUE
150,0,You Can Smell Hillarys Fear,FALSE
857,707,Iran Nuclear Deal: Does Obama want Israel to commit suicide?,TRUE
633,483,Romney's timely Trump trolling,TRUE
666,516,"We do not like trampolining, say hedgehogs",FALSE
529,379,What Scientists Found Inside This 800-Year-Old Pot... Is Changing History!,FALSE
582,432,Get Ready For Civil Unrest: Survey Finds That Most Americans Are Concerned About Election Violence,FALSE
327,177,"FACT CHECK: Hillary Clinton's Speech To The Democratic Convention, Annotated",TRUE
822,672,"Tolerant Liberals Show Nothing But Contempt, Hatred Toward Nations Only Black Supreme Court Justice",FALSE
1183,1033,Will Hillary Clinton lose the election because of the FBI email investigation?,TRUE
1405,1255,Help Blow Up the Globalists Plot to Steal the Presidency- Make This Go Viral,FALSE
367,217,8 classic football banners of our time,FALSE
261,111,Glorifying Violence,FALSE
860,710,Would Trump presidency threaten rule of law?,TRUE
681,531,Donald Trump cant resist blaming Bill Clinton when his own sexism comes up,TRUE
889,739,Police morale can wait: How the Baltimore riots should reshape Attorney General Loretta Lynchs agenda,TRUE
279,129,Conspiracy theories swirl around the death of Antonin Scalia,TRUE
344,194,Raqqa/Mosul: Politicians Fiddle As Middle East Burns,FALSE
296,146,"Cyrus Mistry renames himself Rohit Sharma-Mistry, gets job back",FALSE
1057,907,"Chris Christie: If I Run, I Will Beat Hillary Clinton",TRUE
229,79,Bernie Sanders' call for ouster of two convention co-chairs rejected,TRUE
810,660,American Funhouse: Manufacturing Consent,FALSE
812,662,Heres What Clinton and Trump Must Do on the Debate Stage to Win the Night,TRUE
1194,1044,Obama on 'The Daily Show:' What happened to common conversation? (+video),TRUE
1403,1253,"Sanders wins in Wisconsin, keeping alive his improbable bid for the nomination",TRUE
335,185,Why Bernie Sanders needs to start winning big states  big,TRUE
526,376,Obamacare Premiums Spike an Average of 25%!,FALSE
1077,927,Hope and hype of Hiroshima cant conceal Obamas dismal record on nuclear disarmament,TRUE
366,216,Authorities search for clues after raid thwarts potential 'Belgian Charlie Hebdo' attack,TRUE
1281,1131,"Black Agenda Radio for Week of Nov. 7, 2016",FALSE
329,179,Connecticut Becomes First State To Boycott Indiana Over LGBT Discrimination Law,TRUE
724,574,OPEC sees oil prices exploding to $200 a barrel,TRUE
692,542,Comment on A Group Of Reluctant Men Hold Kittens For The First Time. Hilarity Ensures by para para dinle,FALSE
280,130,"What is one more election thread, ehhh?",FALSE
1225,1075,"Iowa caucus results: Ted Cruz wins, Hillary Clinton declares victory",TRUE
32,32,What (the Obama administration is) going to come out with in the next several months is youre not even going to be able to burn coal very limitedly in the existing plants.,FALSE
885,735,"Steve Quayle On Economic Collapse, World War 3 and U S elections",FALSE
785,635,Clinton Takes First Step To Dispel Doubts About Candidacy,TRUE
545,395,US officials scanning terror databases in search for Paris attack suspects,TRUE
651,501,Why Donald Trump is beating Fox News -- and GOP rivals,TRUE
426,276,American Express disowns Pink Floyd singer Roger Waters because of pro-Palestinian views,FALSE
642,492,Attorney general nominee offers careful backing of Obama policies,TRUE
1112,962,"Charlie Hebdo attack: Suspects' names, photos released",TRUE
1180,1030,GOP lands no solid punches while sparring with Clinton over Benghazi,TRUE
258,108,"The amazing AquTru water filter, version 2.0, is now in stock: I've snagged 500 units for Natural News readers at a deep discount",FALSE
946,796,New Lunar Craters Mystery | Space News,FALSE
111,111,"Under President Obamas health-care reforms, the premium for an average plan for a family didnt go down by $2,500 per year, its gone up about $2,500 per year.",TRUE
1207,1057,DONALD TRUMP & DEUTSCHE BANK: DID CLINTONS LEAN ON US JUSTICE DEPARTMENT?,FALSE
274,124,Third-party presidential candidates fight for 15% in polls  and a spot in debates,TRUE
1012,862,Former GOP Representative Calls For Armed Insurrection (VIDEO),FALSE
584,434,Retired Bishop Explains Why The Catholic Church Invented Hell [Watch],FALSE
815,665,Clinton holds narrow lead over Trump on eve of conventions,TRUE
1011,861,"In Rand Paul and Marco Rubios feud over Cuba policy, a preview of GOPs 2016 foreign policy debate",TRUE
991,841,Harry Reid Calls Trade Push By Obama And GOP 'Insanity',TRUE
612,462,November 8 Is (Finally) Here: An Abridged Election Day Resource Guide,FALSE
1381,1231,"Spy Scandals, Globalism and the Betrayal of America",FALSE
441,291,State Department warns of possible terror attack in South Africa,TRUE
1467,1317,North Korea Threatens Sacred Nuclear War Against Israel if this country continue supporting ISIS,FALSE
1350,1200,"This is tyranny not democracy, says party with single MP",FALSE
472,322,The Supreme Court cannot hide on Obamacare,TRUE
1449,1299,Sanders: Democratic Party hasn't been fair to me,TRUE
499,349,The Path To Total Dictatorship: Americas Shadow Government And Its Silent Coup,FALSE
561,411,Media turn blind eye to Hillary Clintons glaring mistakes,TRUE
1019,869,Public vs. Media on War,FALSE
1367,1217,Can Donald Trump recover from this?,TRUE
924,774,TREY GOWDY: WHAT IN THE WORD IS LORETTA LYNCH DOING TALKING TO COMEY,FALSE
515,365,VIDEO: Creepy Clown Gets Pistol-Whipped!,FALSE
410,260,Repudiating the Media,FALSE
1422,1272,"What happens to delegates won by Rubio, other ex-candidates?",TRUE
147,147,Says the Arizona immigration law expressly bans racial profiling.,TRUE
91,91,I belong to the AFL-CIO.,TRUE
911,761,Julian Assange October Surprise REVEALED,FALSE
1080,930,Iran nuclear talks: What if the deal falls through?,TRUE
128,128,Barack Hussein Obama will ... force courts to accept Islamic Sharia law in domestic disputes.,FALSE
953,803,Scalias death comes just a month before the courts biggest abortion case in years,TRUE
497,347,Senate Makes History By Confirming Loretta Lynch As U.S. Attorney General,TRUE
734,584,White House Monitoring Iran Aid Ship to Yemen,TRUE
243,93,French police hunt two brothers accused of Charlie Hebdo terror attack,TRUE
1000,850,Carly Fiorina will appear in top-tier Reagan Library debate,TRUE
901,751,Booze Brands Polarize Just Like Politicians,TRUE
1266,1116,"BREAKING : LGBT Group Endorses Trump, Says, Hillary is Detrimental for Gays  TruthFeed",FALSE
1309,1159,"Trump suggests he might have prevented 9/11 attacks, extending feud with Bush",TRUE
1272,1122,New Leak Exposes Hillarys Real Plan For Clinton Foundation Foreign Donors,FALSE
774,624,Re: 22 Reasons Why Starting World War 3 In The Middle East Is A Really Bad Idea,FALSE
186,36,Donald Groped Hillary in 2005! Trump and Weiner Sext Each Other!,FALSE
925,775,The Northern Sea Route: New Prospects for the Pacific Rim | New Eastern Outlook,FALSE
772,622,Trump Will Skip GOP Debate As Feud With Fox News Boils Over,TRUE
978,828,Republican Protester Says He Was Nearly Killed After Trump Says Take Him Out,FALSE
1267,1117,The Political Songs Of Leonard Cohen,FALSE
892,742,The Truth About Atlantis [Video],FALSE
824,674,Manhunt shifts to lone cabin in upstate New York: Prisoner hideout?,TRUE
28,28,"ISIS supporter tweeted at 10:34 a.m. Shooting began at 10:45 a.m. in Chattanooga, Tenn.",FALSE
1190,1040,"We must smash the Clinton machine: Democratic elites and the media sold out to Hillary this time, but change is coming",TRUE
409,259,FOX News Just Admitted It Made Up Story About Hillary Being Indicted For Foundation,FALSE
1108,958,Baby Bonds: A Plan for Black/White Wealth Equality Conservatives Could Love?,FALSE
1203,1053,Brexiters set up demented peoples courts,FALSE
67,67,"Says the man who rushed the stage at him in Dayton, Ohio, had chatter about ISIS, or with ISIS in his social media posts.",FALSE
148,148,Says Gov. Rick Perry has been begging for the federal government to send the Coast Guard to patrol two lakes on the U.S.-Mexico border.,FALSE
108,108,"Under President Barack Obamas jobs bill, states would no longer have to lay off teachers, firefighters and police officers.",TRUE
579,429,Watching These 55 ISIS Terrorists Get Blown to Smithereens is Sure to Brighten Your Day,FALSE
1304,1154,"China, Russia, The Silk Road, Commodities, Nixon And A Massive Bull Market In Gold & Silver",FALSE
377,227,"Clinton Camp Desperate, Russia Trains for WWIII",FALSE
1437,1287,Congressional auditors: VA health care is high-risk,TRUE
89,89,Austin is burdened by the fastest-growing tax increases of any major city in the nation.,FALSE
40,40,Says a U.S. Supreme Court justice suggested that some U.S. cases will be decided based on South African law.,FALSE
1069,919,Can Anyone Beat Trump in the Primary? History Says No,TRUE
169,19,The 1 chart that explains everything you need to know about partisanship in America,TRUE
433,283,"As Rand Paul stalls, Ted Cruz seeks to pick up support among libertarians",TRUE
1378,1228,Outsider campaigns seek inside track,TRUE
1264,1114,Tradesman keeps promise,FALSE
1218,1068,Federal court: NSA phone record collection is excessive,TRUE
727,577,I dare you to restrain yourself from laughing at Trump and Hillary in a stronger hot show,FALSE
358,208,Jubilee Year of Mercy ends on November 20. Following Judgment?,FALSE
202,52,Tree Shaped Vertical Farms That Grow 24 Acres Of Urban Crops,FALSE
575,425,2:00PM Election Day Water Cooler 11/8/2016,FALSE
555,405,US abstains from UN vote calling for end to Cuban embargo,FALSE
81,81,"At some point in their lives, 99% of women use birth control.",TRUE
1360,1210,Is there any way Obama can fill Supreme Court vacancy?,TRUE
1015,865,Al Qaeda rep says group directed Paris magazine attack; US issues travel warning,TRUE
765,615,Trump refuses to say whether he'll accept election results,TRUE
961,811,Major Voter Fraud Already Running Rampant Against Republicans,FALSE
1214,1064,Hung jury in Jodi Arias sentencing phase removes possibility of death sentence,TRUE
155,5,"Tehran, USA",FALSE
236,86,"Ted Cruz is toast: Its not just that he wont be president  his days in the Senate are numbered, too",TRUE
1357,1207,Patriots Day 2015: Boston does not stand alone,TRUE
1095,945,Missing on GOP debate stage: A future president (Opinion),TRUE
