,Unnamed: 0,News,Label
1123,973,SHOCK VIDEO : Hillary Needs Help Climbing ONE SINGLE STEP in Florida  TruthFeed,FALSE
146,146,Barack Obama has never even worked in business.,FALSE
78,78,Says Charlie Crist supports cuts to the Medicare Advantage program.,FALSE
452,302,The system set Boehner up for failure,TRUE
19,19,"Almost 100,000 people left Puerto Rico last year.",TRUE
51,51,"Maggie Hassan raised tuition, making it the highest in America.",FALSE
208,58,Donald Trump: Hillary Clinton has 'caused tremendous death',TRUE
1120,970,Leaked email shows Monsanto Executive V.P. invited to 'Hillraiser' fundraiser to put Clinton into the White House for Monsanto's benefit,FALSE
1084,934,It Turns Out Trump Put off Investigators for 6 Months While He Destroyed Emails,FALSE
662,512,Why is it the first time Im hearing about this? asks office wanker,FALSE
1096,946,Senators Seek Living Wage for Capitol Hill Contractors,TRUE
1222,1072,Hillary Clinton speech to attack Donald Trump's 'dangerous' foreign policy plans,TRUE
842,692,"The Left Turns on Bob Dylan for His Pro-Israel Views, Refusal to Acknowledge Nobel Prize",FALSE
740,590,"India's Stonehenge: 7,000-Year-Old Megalithic Site is Oldest Observatory in South Asia",FALSE
1458,1308,21 dead at Radison Blu hotel in Mali,TRUE
709,559,Georgia Abandons Ukraine's Anti-Russian Obsession - Archil Sikharulidze,FALSE
500,350,To the Youth a Day After the Election: Another World Is Possible,FALSE
1235,1085,4 Things The New Hampshire Primary Will Tell Us,TRUE
694,544,Donald Trump Pushes Republican Party to Its Breaking Point,TRUE
807,657,Israel hawks to Pope Francis: Stay out of politics,TRUE
910,760,Boy With Autism Makes His First Friend Ever And His Mom Cant Stop Crying,FALSE
966,816,It isnt Islamophobia when an Oklahoma GOP State Rep. says Islam is a cancer in our nation that needs to be cut out,FALSE
98,98,"Since 1968, more Americans have died from gunfire than died in all the wars of this countrys history.",TRUE
1477,1327,They Dont Speak For Me  Evangelical PhD SLAMS Religious Right Leaders Supporting Trump,FALSE
941,791,"Mitt Romney Calls Donald Trump 'A Phony, A Fraud'; Trump Hits Back",TRUE
336,186,Leaked: Whats in Obamas trade deal,TRUE
935,785,Southern Poverty Law Center Targets Anti-Jihad Crusaders (Ann Corcoran Honored!),FALSE
1400,1250,Honor Our Immigrant Veterans Replayed,FALSE
477,327,How Jeb Bush can avoid being the Jon Huntsman of 2016,TRUE
784,634,How Democrats killed Obama's college savings plan,TRUE
509,359,Study: Phytochemical Found In Broccoli And Cauliflower Attacks Prostate Cancer Cells,FALSE
1199,1049,"Comment on Voting Is Rigged & Used To Pacify The Public Says Three-Time US Presidential Candidate Ron Paul by Anonymous: There Is No One Way To Live On This Planet, But We Can Be Harmonious  Collective Evolution",FALSE
926,776,Cruz campaign: We could have stopped Trump if Rubio became running mate,TRUE
351,201,"Trump slams 'corrupt' media, as more women make sexual assault claims",TRUE
418,268,The Fix Is In: NBC Affiliate Accidentally Posts Election Results A Week Early: Hillary Wins Presidency 42% to Trumps 40%,FALSE
275,125,"Bush, Rubio and Kasich eye one another in the shadow of Trump",TRUE
317,167,Fifteen Quotes Proving False Flag Terrorism & the Existence of a Shadow Government,FALSE
468,318,Scientists Fascinated By Lake Under The Sea: Those Who Enter Never Come Out [Watch],FALSE
195,45,Obama makes the right call to tough it out in Afghanistan,TRUE
241,91,Silent Counter-Coup by 17 Intel Agencies To Stop Crooked Clintons [Video],FALSE
36,36,Austin is a city that has basically doubled in size every 25 years or so since it was founded.,TRUE
83,83,The amount of attention paid this week to Chris Christie makes the coverage of Benghazi ... pale in significance.,FALSE
990,840,Netanyahu warns supporters he may lose in Tuesdays election,TRUE
249,99,How Ted Cruz Became Ted Cruz,TRUE
141,141,"In Rhode Island, 9 percent of workers use the states temporary disability insurance program each year while in New Jersey, the rate is only 3 percent.",FALSE
242,92,"Why Hillary Clinton, not Bernie Sanders, 'won' town hall",TRUE
201,51,"3 Effects of Substance Abuse on Individual, Family and Community",FALSE
977,827,"Head Of Medicare, Who Oversaw Obamacare Rollout, Will Step Down",TRUE
73,73,The only time in our history when the debt has been higher than this was the end of World War II.,TRUE
1341,1191,Dr. Duke and Andrew Anglin discuss the most important vote and election of our lives!,FALSE
610,460,Training French soldiers to supervise Daesh,FALSE
1029,879,Iowa nightmare revisited: Was correct winner called on caucus night?,TRUE
614,464,A bad night for front-runners and a good night for governors,TRUE
869,719,We told you so! The Zika virus is harmless,FALSE
775,625,"Fifteen years after NATO bombings, Montenegro wants to join NATO",FALSE
180,30,Jeffrey Sewell et al. : Metabiology face to face with Artificial Intelligence [VIDEO],FALSE
97,97,"The average student in Florida, what they actually pay out of pocket at our major universities for tuition is as much or less than what they spend on cellphones.",TRUE
247,97,"Fireworks erupt between Trump and Bush, Rubio and Cruz at GOP debate",TRUE
804,654,Obamas Arctic Trip Comes as Climate Change Builds as 2016 Issue,TRUE
1433,1283,"The American Way: Socialism for the Rich, Free Enterprise for the Rest",FALSE
315,165,Iran agrees to nuclear restrictions in framework deal with world powers,TRUE
1253,1103,Obama ISIS war authorization: Request sent to Congress,TRUE
480,330,New Yorkers fight to overturn ballot selfie ban,FALSE
1022,872,The Iowa caucuses are closer than you think,TRUE
502,352,Protester charged with shooting officers in Ferguson,TRUE
1479,1329,Anyone from the family who can understand what I speak will be appointed as UP CM: Mulayam Singh,FALSE
1402,1252,Trump Supporter Jailed for Trying to Rig the Election By Committing Voter Fraud,FALSE
1046,896,Unravelling Chattanooga: What do we know about shooter?,TRUE
86,86,There is a federal criminal law that says its a crime to transport dentures across state lines.,TRUE
697,547,'NO CAMP! NO CAMP!': Scuffles break out at Hungary train station after police stop migrant train,TRUE
1361,1211,"Saudi Arabia's King Abdullah was incremental reformer, US ally (+video)",TRUE
971,821,Is This Why The Smash In Gold & Silver Is Happening? A Shocking Game-Changer For Gold & Silver Is Now Unfolding,FALSE
731,581,The Middle Easts sick state,TRUE
221,71,GOP establishment nightmare? Ted Cruz vs. Donald Trump,TRUE
1332,1182,Boehner 'baffled' by Israeli spying report,TRUE
756,606,CNN Talker Famous for Saying 'Pu***' on Air Lashes Out at Newt for Saying Megyn's 'Obsessed with Sex',FALSE
270,120,Bernie needs to be ground to a pulp. Leaked Email to John Podesta in February,FALSE
689,539,"NGOs should condemn terrorists in Syria, not Russia fighting them  Foreign Ministry",FALSE
368,218,Tweetwave,FALSE
899,749,US Not Ruling Out Daesh Involvement in Afghanistan Offensive,FALSE
1285,1135,"Jordanian fighter jets strike hard at ISIS, pay tribute to murdered pilot",TRUE
34,34,Says Mark Pryor votes with Obama 93 percent of the time.,TRUE
312,162,VIDEO: Journalist Shot by Militarized Police at Standing Rock While Conducting an Interview,FALSE
309,159,Super PAC Gets Early Start on Pushing for a 2016 Clinton Campaign,TRUE
1087,937,Taking Trump voters concerns seriously means listening to what theyre actually saying,TRUE
958,808,The Israeli Trumpess,FALSE
1136,986,ICE Agent Commits Suicide in NYC; Leaves Note Revealing Govt Plans to Round-up & DISARM Americans During Economic & Bank Collapse | EndingFed News Network,FALSE
693,543,House yanks first spending bill off the floor,TRUE
672,522,"When They Asked Her What She Thinks of Hillary Clinton, They Never Expected Her to Say THIS!",FALSE
1157,1007,FBI REDUX: Whats Behind New Probe into Hillary Clinton Emails?,FALSE
12,12,"When Mitt Romney was governor of Massachusetts, we didnt just slow the rate of growth of our government, we actually cut it.",FALSE
245,95,CNN: One voter can make a difference by voting repeatedly,FALSE
827,677,Michael Moore: Joe Blow Will Vote Trump As Ultimate F You to the Elite A Human Molotov Cocktail,FALSE
65,65,Transgender individuals in the U.S. have a 1-in-12 chance of being murdered.,FALSE
340,190,Culchie Tries To Explain Rules Of 25 One More Time,FALSE
359,209,Iraq launches operation against ISIS in Anbar province,TRUE
1362,1212,"Re: The U.S. Will Lose Global Reserve Status, Expect 80-90% Devaluation Of the U.S. Dollar",FALSE
1320,1170,"Giuliani, suggesting Trump may have exaggerated in lewd comments, says, talk and action are two different things",TRUE
546,396,"ISIS Declares It Will kill Palestinians One By One, Yet Remains Quiet On Israel",FALSE
142,142,"In just 17 years, spending for Social Security, federal health care and interest on the debt will exceed ALL tax revenue!",TRUE
790,640,Trump Makes Last-Minute Push To Appeal To Whites - The Onion - America's Finest News Source,FALSE
33,33,We cut business taxes so today 70 percent of our businesses dont pay a business tax.,TRUE
138,138,"Research shows that a vast majority of arriving immigrants today come here because they believe that government is the source of prosperity, and thats what they support.",FALSE
268,118,3 Questions Ahead Of Tonight's Democratic Debate,TRUE
511,361,Paris Tragedy Could Shake Up 2016 Race,TRUE
1165,1015,"Kurdish forces, backed by U.S. airstrikes, launch offensive in Iraq",TRUE
1091,941,Hybrid Wars 8. Strategies Against Africa  Introduction,FALSE
1340,1190,"Fear of Trump sparking a surge in citizenship, voter applications",TRUE
789,639,Afghanistan: 19 die in air attacks on hospital; U.S. investigating,TRUE
166,16,Shocking! Michele Obama & Hillary Caught Glamorizing Date Rape Promoters,FALSE
405,255,Trump The President: What Does That Mean For The World? - CounterCurrents.org,FALSE
1244,1094,The 8th Democratic Debate In 100 Words (And 4 Videos),TRUE
1444,1294,Travel: Conor McGregors Guide To New York,FALSE
1441,1291,Experts Just Uncovered The Top Secret Server Trump Uses To Talk To Russia,FALSE
421,271,"Cant build a wall, hands too small!  NYC anti-Trump protest (Streamed live)",FALSE
190,40,First Take: Wall Street bids goodbye to June hike,TRUE
699,549,How a $15 minimum wage went from extreme to enacted,TRUE
1124,974,"After vowing to end two wars, Obama may leave three behind",TRUE
1366,1216,Donald Trump is blatantly racist  and the media is too scared to call him out on it,TRUE
1230,1080,Lawyer Who Kept Hillary Campaign Chief Out of Jail in DOJ Hillary Probe,FALSE
1239,1089,TIME MAGAZINE Reaches NEW LOW: Its Sexist To Investigate Hillary Clinton!,FALSE
266,116,APOCALYPSE NOW: Trump Voters Warn Of Revolution If Clinton Wins,FALSE
1043,893,Who's winning Indiana? It's anybody's guess,TRUE
836,686,Obama trade bill in trouble,TRUE
713,563,The GOP would unite against Trump at its own peril,TRUE
544,394,"Human remains suggest explosion brought down EgyptAir plane, forensics official says",TRUE
1408,1258,Duterte Calls US Admin Monkeys for Halting Arms Sales,FALSE
1312,1162,The People Are Laughing at the Liberal Media,FALSE
63,63,"There are 321,092 public school teachers in Texas. And there are 313,850 non-teachers in our public schools.",TRUE
893,743,Major Corporate Sponsors Are Scaling Back Support for GOP Convention,TRUE
1284,1134,300 US Marines To Be Deployed To Russian Border In Norway,FALSE
82,82,"In the past 20 years, Egypt has made great strides in political and democratic reform.",FALSE
1056,906,News Shot: Detroit Airport Uses New System To Control Travelers,FALSE
1013,863,Jeb Bush blames Iraq unrest on Obama,TRUE
484,334,Netflix Ceo: TVs Future includes Hallucination Pills,FALSE
330,180,Scott Walker Confronts Doubts About His Grasp of Foreign Policy,TRUE
240,90,Revelation Unleashed: Unlocking The Mysteries Of The Bibles Most Mysterious Book,FALSE
495,345,Why the drop in income inequality?,TRUE
376,226,Iran letter blowback startles GOP,TRUE
1049,899,"University of Missouri, please immediately fire employees who taunted media",TRUE
1126,976,Donald Trump Wins The Presidency In Historic Mandate Victory As Hillary Clinton Concedes,FALSE
1299,1149,"They Said What?!: Find Out What Reba McEntire, Whoopi Goldberg, And Pope Francis Have To Say",FALSE
652,502,Election 2016 and the Weaponization of the American Public,FALSE
683,533,Will Clintons experience be a liability?,TRUE
1051,901,Trump ups the ante in Indiana,TRUE
752,602,The First Space Photo Of Earth - Shot From A Third Reich Rocket In 1946,FALSE
322,172,So That Happened: Did Obama Forget That The GOP Runs Congress?,TRUE
1474,1324,"Walgreens to close 200 stores, boost cost cutting",TRUE
174,24,Inferno and the Overpopulation Myth,FALSE
1269,1119,Gary Johnsons Post-Debate Reactions,TRUE
823,673,"Us vs Them: When Politics is Treated Like a Football Game, No One Wins",TRUE
1461,1311,"United States  reformation or fracture?, by Thierry Meyssan",FALSE
631,481,"Anonymous hacker Deric Lostutter faces 16 years in prison, while Steubenville rapists walk free",FALSE
1443,1293,GOP debate: 's Reality Check Team inspects claims,TRUE
982,832,United States  Reformation or Fracture?,FALSE
821,671,US Airstrike Kills Four Iraqi Troops Near Mosul,FALSE
1454,1304,"What is an ""income"" tax and where did it come from? NOT the 16th Amendment!",FALSE
840,690,Jane Sanders to FBI: Get on with Clinton email probe,TRUE
304,154,Social Media Is Censoring FBIs Re-Opened Clinton Email Investigation,FALSE
605,455,Donald Trump: The key to his success (Opinion),TRUE
1138,988,Trump doesnt have a national campaign. So the GOP is trying to run one for him.,TRUE
845,695,Oklahoma Fraternity Is Closed Over Video Of Racist Chant,TRUE
617,467,The Anatomy of Crisis and the Decline of US Empire,FALSE
1113,963,Why the Ted Cruz-Marco Rubio debate mattered most (+video),TRUE
1456,1306,Drudge goes all in for Trump,TRUE
1288,1138,Obama Plans to Press Ahead With Guantanamo Bay Closure,TRUE
161,11,Donald Trumps Shockingly Weak Delegate Game Somehow Got Even Worse,TRUE
1242,1092,Superbug cases spur FDA warning on dirty medical scopes,TRUE
457,307,Iran: Why the best outcome now is to keep negotiating without reaching a deal,TRUE
263,113,The David Duke Show: Hillarys Treason and Why Trump & Duke Will Win,FALSE
302,152,Stuff in the News That No One Is Talking About Because of the Election,FALSE
334,184,"Come on, Paul Ryan must be running in 2016, right? Right?",TRUE
779,629,Kasich: Voters Are Starting to Pay Attention,TRUE
998,848,AUSTRIAN DISGRACE: No jail for Muslim migrant who dumped his own baby in the middle of the road after he got drunk and enraged,FALSE
645,495,Strong jobs number holds risks for Clinton,TRUE
855,705,"CNN Reach New Low, Call Sheriff Clarke A Terrorist After Trump Gave Him The Most Important Job! | EndingFed News Network",FALSE
1205,1055,US Presidential Elections Sound a Warning of Catastrophes to Come,FALSE
1038,888,Obamas plan to boost defense budget points to brewing national security debate,TRUE
969,819,The Israeli Trumpess,FALSE
938,788,The early 2016 primary calendar is now set. It will change.,TRUE
305,155,Obama Inches Closer to Veto-Proof Support for Iran Nuclear Deal,TRUE
1283,1133,An Angry John Podesta Issues A Statement On Reopening Of FBI Probe,FALSE
57,57,"They were going to build the wall a while ago, not so long ago, like in 06. And they couldnt get environmental impact statements.",FALSE
770,620,Guilty Verdict Returned In 'American Sniper' Murder Trial,TRUE
1447,1297,Congress and its 'outsiders': The critical struggle over who is really in charge,TRUE
471,321,"Our real police/race problem: Diverse forces, white resentment, and Americas persistent divides",TRUE
1451,1301,Conservatives in a meltdown: National Reviews confused Against Trump issue is an amazing testament to the rights implosion,TRUE
346,196,Washington Home Depot store receives order for five-thousand gallons of gold exterior paint,FALSE
646,496,Sanders warns Clinton against moderate as VP,TRUE
29,29,Youth unemployment in minority communities is about 40 to 45 percent.,TRUE
1394,1244,"Trump's lean campaign machine relying mostly on donor cash, not his own",TRUE
44,44,We have a director of homeland security who cannot use and will not use the term 'terrorist attack' but instead substitutes 'man-made disaster.' ,FALSE
352,202,Only Demented Imbeciles Want A Killary Reign Of Terror,FALSE
874,724,Amurexit from NAFTA TPP Wall Street and Global Policeman,FALSE
559,409,New evidence that the legal immigration system discriminates against Latin Americans,TRUE
1335,1185,Theres a good reason protesters at the University of Missouri didnt want the media around,TRUE
438,288,Wingnuts have a death-grip on Congress: Why Paul Ryan cant control the House GOP,TRUE
521,371,Is the GOP losing Walmart?,TRUE
1238,1088,Banana Republic Election in the United States?,FALSE
1053,903,300 US Marines Deployed To Norway Near Russian Border For First Time Since World War II,FALSE
103,103,"Says Secretary of State John Kerry, when he was a senator, flew to Managua and met with a communist dictator there, Daniel Ortega, and accused the Reagan administration of engaging in terrorism.",TRUE
442,292,Who Lost Iraq?,TRUE
1393,1243,High Court Judges looking for a Truss to support them. More soon.,FALSE
1419,1269,"Comment on St. Charles Borromeo, Patron Saint of Catechists and Seminarians by jose",FALSE
1234,1084,"Obamacare Is Back At The Supreme Court, And These 6 Lives Hang In The Balance",TRUE
1376,1226,Abortion bill dropped amid concerns of female GOP lawmakers,TRUE
102,102,"Raising the minimum wage to $10.10 an hour, would help lift over a million Americans out of poverty.",TRUE
1178,1028,Sanders challenge: Winning over Obama supporters,TRUE
1065,915,The GOP Is Dying Off. Literally.,TRUE
649,499,Dr. MacDonald & Dr. Duke Expose the Vicious War on Trump by the Jewish Establishment!,FALSE
197,47,He didnt know the boy didnt want to be raped  court throws out Muslim migrant child sex charge and Germans are in shock,FALSE
256,106,Nuclear weapons question,FALSE
1438,1288,"Leaked Email: If She Wins, Hillary Will Own The Supreme Court for the Next 30 to 40 Years",FALSE
77,77,Says one out of three U.S. homeless men is a veteran.,FALSE
300,150,Classless Obama Refuses Photo-Op of White House Welcome with Trump,FALSE
178,28,Pure chaos: Donald Trumps campaign management offers a glimpse into his governing style (spoiler alert: its terrible),TRUE
862,712,Bernie Sanders Says What The Media Wont: Trump Is A Gutless Political Coward,FALSE
350,200,We Live In A Time Where Each Individual Has Immense Power,FALSE
622,472,"14 Days to Do 14 Things, If Hillarys Indicted-Extreme Violence Expected",FALSE
391,241,"""America has a simple ideology"": how one of Russia's top US experts explains America",TRUE
424,274,Comment on Brother of Clintons Campaign Chair is an Active Foreign Agent on the Saudi Arabian Payroll by marlene,FALSE
519,369,Obama and Putin outline competing visions on Syria,TRUE
661,511,5 takeaways from the Republican debate,TRUE
227,77,Lavrov and Kerry discuss Syrian settlement,FALSE
1293,1143,Will Nancy Pelosi miss John Boehner? Depends.,TRUE
570,420,The Benghazi bust: Trey Gowdy and his GOP colleagues embarrassed themselves,TRUE
531,381,Trump treads on tradition in New Hampshire,TRUE
1463,1313,Editorial: Presidential stakes are high for nuclear arsenal - The Boston Globe,TRUE
399,249,The circus of liars - America's three rings of evil clowns,FALSE
1028,878,"Supreme Court to consider redefining 'one-person, one-vote' principle",TRUE
30,30,Says Paul Ryan is still endorsing Trump.,TRUE
711,561,People in Europe are full of fear over refugee influx,TRUE
865,715,Paris climate summit: What to expect from historic talks,TRUE
427,277,Clinton condemns Trump over Chicago violence,TRUE
970,820,US Insiders  Not Russia  Leaked Clinton Emails,FALSE
820,670,Mitt Romney Fans Speculation Over Another White House Run,TRUE
538,388,Scott Walker and questioning Obamas faith,TRUE
39,39,"Under President George W. Bush, we added $4.9 trillion to the debt. Under President Obama weve added $6.5 trillion to the debt.",TRUE
1107,957,President Obama's persistent and puzzling passivity on terrorism,TRUE
101,101,"The Atlanta streetcar is expected to create 930 jobs during construction, totaling more than 5,600 jobs over the next 20 years.",FALSE
1114,964,"David Sweat shot, captured alive after New York manhunt",TRUE
319,169,"Former Ambassador Andrew Young calls for end to water fluoridation, Civil Rights Issue",FALSE
1407,1257,South Carolina primary brings high stakes for Marco Rubio and Jeb Bush,TRUE
131,131,He told gay organizers in Massachusetts he would be a stronger advocate for special rights than even Ted Kennedy.,TRUE
664,514,Lawmakers caught in battle between House ethics cops,TRUE
793,643,OnPolitics | 's politics blog,TRUE
308,158,Shiite Militias Join Iraqs Mosul Attack,FALSE
1392,1242,Hispanic Crowd Boos Marco Rubio off Stage,FALSE
1317,1167,From Berkeley to Kent State,FALSE
1198,1048,"Sure, We Want An Honest And Trustworthy President, But It's Complicated",TRUE
291,141,Elizabeth Warren Just Blasted The FBI Director For Going After Hillary Instead Of Wall Street Crooks,FALSE
1481,1331,"American Dream, Revisited",FALSE
154,4,The Battle of New York: Why This Primary Matters,TRUE
165,15,How women lead differently,TRUE
1141,991,Puh-LEEZE! DOJs policy reminder to FBI is shameless (especially considering THIS)  twitchy.com,FALSE
349,199,'Historic' climate deal in sight as nations parse final text,TRUE
604,454,Hillary Clinton: No role whatsoever for American soldiers on the ground in Iraq,TRUE
884,734,What Youre Not Told: 90% Of American Media Is Controlled By Six Corporations,FALSE
1260,1110,Adelson's Review-Journal Gives Trump First Major Endorsement,TRUE
1090,940,There is such a thing as being too late: Obama issues a desperate call for a global climate deal,TRUE
496,346,Walmart Goes Against The Grain Of Obamas America With New Thanksgiving Ad,FALSE
628,478,Re: DOJ AG Loretta Lynch Advised FBI Director to Keep New Emails from Congress,FALSE
636,486,A sharpened debate: Is it ethical to not vote this year for president?,TRUE
1172,1022,Biden previews battle against Clinton,TRUE
657,507,Teenage Boy KNOCKS OUT His Classmate For Assaulting Their Female Teacher In The FACE- And Its EPIC!,FALSE
1204,1054,"Prime Minister of France says, if we grant immediate asylum to illegal alien Muslim invaders, by tomorrow they will be speaking French and sharing French values",FALSE
357,207,Clinton Vs. Trump: Latest Electoral Prediction [Greg Laden's Blog] | Science and Technology,FALSE
237,87,Obamas speech in Selma was an answer to those who question his love for America,FALSE
595,445,"Clinton and Trump: How they view ISIS, Putin, and US generals",TRUE
669,519,Ive Always Been An Admirer Of Donald Trump  Taoiseach,FALSE
189,39,Both parties want to craft populist messages for 2016,TRUE
668,518,"Libertarian VP Candidate Gives Up, Will Focus on Preventing Trump Presidency",TRUE
37,37,"The nuclear test conducted in our nation this time is the Earth's 2,054th nuclear test. The five permanent members of the U.N. Security Council have conducted 99.99 percent of the total nuclear tests.",TRUE
1386,1236,Western Culture is Wrecking Entire Continents,FALSE
252,102,Why the latest Patriot Act reform wont be enough to rein in the NSA,TRUE
446,296,China Airport Security Robot Gives Electroshocks,FALSE
1452,1302,"Reinventing Democracy in America Starts by Voting, Then Building an Accountability Movement",FALSE
950,800,Battle for the Ages,FALSE
1466,1316,Voter Dreading Being Sent Over To Visibly Stupid Poll Worker - The Onion - America's Finest News Source,FALSE
244,94,"The Mandela Effect was made by one overlooked 33 year old man, an ascended master (video and proof)",FALSE
26,26,Hate crimes against American Muslims and mosques have tripled after Paris and San Bernardino.,TRUE
72,72,"The new Arizona immigration law ""says that any police officer can stop anyone who appears to them to be reasonably suspicious of being an undocumented person.""",TRUE
818,668,AT&T-Time Warner Merger: Another Media Consolidation That Puts Profits Over Consumers,FALSE
722,572,"A noun, a verb and Donald Trump: Rubio seeks to seize on Murphys flaw",FALSE
665,515,"New O'Keefe Video: Clinton Campaign, DNC Coordinated With Organizations To Incite Violence At Trump Events",TRUE
461,311,Trump Family Say Trump Brand Has NOT Been Damaged,FALSE
172,22,Hillary Clinton Makes A Bipartisan Appeal on Staten Island,TRUE
778,628,US: Kurdish Troops Will Be Involved in Invading ISIS Capital of Raqqa,FALSE
675,525,Which Non-OPEC Producers Can Be Expected To Cut?,FALSE
360,210,UKIP MEPs Steven Woolfe & Mike Hookem reported to French police over Strasbourg scuffle,FALSE
868,718,"Supreme Court: your right to a ""speedy trial"" ends when you're declared guilty",TRUE
482,332,Im glad that he won: The surprising Palestinian reaction to Netanyahus win,TRUE
456,306,"Democrats, Republicans in tight races as Iowans prepare to caucus",TRUE
591,441,Hillary Fan SLEEPS At Rally! Snoozy Smurf Steals Show! (ABC News) Coconut Creek FLA,FALSE
1085,935,Russian Navy Moves Guided Missile Ships to Baltic,FALSE
965,815,Tsarnaev Mom: Americans Are Terrorists,TRUE
489,339,White House: GOP Has Failed to Put Points on the Board,TRUE
1329,1179,John Podestas New Global Order,FALSE
1152,1002,Reporter says Clinton camp denying him access to events,TRUE
920,770,Obamas trip to Ethiopia alarms some human rights activists,TRUE
883,733,"Done Deal? Clinton, Trump Shift to General Election after Big Wins",TRUE
518,368,The Other Way of Knowing,FALSE
